<?xml version='1.0'?>
<!DOCTYPE person SYSTEM './xmlfiles/person.dtd'>
<person>
	<name>
		<first>Bob</first>  <last>Smith</last>
	</name>
	<address location="home">
		<street>123 East Elm</street>
		<city>Boston</city>
		<state>MA</state>
		<zip>23130</zip>
	</address>
	<address location="work">
	</address>
	<email primary="true">bob@yahoo.com</email>
	<email primary="false">hacker@yahoo.com</email>
</person>
